{
  "case_id": "GOLDEN-004",
  "suite": "golden",
  "invocation": {
    "index": 10,
    "thread_id": "019f77bb-e087-7121-b579-dc10fee90d5d",
    "client": "Codex CLI",
    "cli_version": "codex-cli 0.144.5",
    "model": "gpt-5.6-sol",
    "reasoning": "high",
    "approval_policy": "on-request",
    "sandbox": "workspace-write",
    "cwd": "/home/rohit/Downloads/Projects/Power-Platform-Learning-and-Delivery-Lab/experiments/powercat-dataverse-webapi-query",
    "skill_path": "/home/rohit/Downloads/Projects/Power-Platform-Learning-and-Delivery-Lab/experiments/powercat-dataverse-webapi-query/.agents/skills/dataverse-webapi-query/SKILL.md",
    "started_at": "2026-07-19T00:17:08.260454Z",
    "completed_at": "2026-07-19T00:17:22.824615Z",
    "ephemeral": true,
    "isolation_claim": "Separate Codex CLI invocation; --ephemeral disables session persistence only.",
    "shared_state": [
      "Repository files",
      "Machine-level Codex state",
      "Installed system skills",
      "Process environment and caches"
    ],
    "exit_code": 0
  },
  "exact_input": "$dataverse-webapi-query Show the Generative Page props.dataApi query shape for a synthetic active-account list selecting name and accountnumber, ordered by createdon descending, page size 10. Use explicit standard logical-name assumptions.",
  "first_output": "**Host:** Model-driven Generative Page using `props.dataApi`.\n\n```tsx\nconst result = await props.dataApi.queryTable(\"account\", {\n  select: [\"name\", \"accountnumber\"],\n  filter: \"statecode eq 0\",\n  orderBy: [\"createdon desc\"],\n  pageSize: 10,\n});\n```\n\nStandard logical-name assumptions:\n\n- Table: `account`\n- Columns: `name`, `accountnumber`, `createdon`, `statecode`\n- Active account state: `statecode eq 0`",
  "event_summary": {
    "event_types": {
      "item.completed": 2,
      "thread.started": 1,
      "turn.completed": 1,
      "turn.started": 1
    },
    "tool_events": [],
    "approval_events": [],
    "diagnostics": [
      "2026-07-19T00:17:08.664382Z ERROR codex_models_manager::cache: failed to load models cache: missing field `supports_reasoning_summaries` at line 88 column 5",
      "2026-07-19T00:17:09.260625Z  WARN codex_rollout::list: state db discrepancy during find_thread_path_by_id_str_in_subdir: falling_back",
      "2026-07-19T00:17:09.261379Z  WARN codex_rollout::list: state db discrepancy during find_thread_path_by_id_str_in_subdir: falling_back",
      "2026-07-19T00:17:09.262033Z  WARN codex_rollout::list: state db discrepancy during find_thread_path_by_id_str_in_subdir: falling_back",
      "2026-07-19T00:17:09.262658Z  WARN codex_rollout::list: state db discrepancy during find_thread_path_by_id_str_in_subdir: falling_back",
      "2026-07-19T00:17:09.263372Z  WARN codex_rollout::list: state db discrepancy during find_thread_path_by_id_str_in_subdir: falling_back",
      "2026-07-19T00:17:09.264544Z  WARN codex_rollout::list: state db discrepancy during find_thread_path_by_id_str_in_subdir: falling_back",
      "2026-07-19T00:17:09.265319Z  WARN codex_rollout::list: state db discrepancy during find_thread_path_by_id_str_in_subdir: falling_back",
      "2026-07-19T00:17:09.266282Z  WARN codex_rollout::list: state db discrepancy during find_thread_path_by_id_str_in_subdir: falling_back",
      "2026-07-19T00:17:09.267141Z  WARN codex_rollout::list: state db discrepancy during find_thread_path_by_id_str_in_subdir: falling_back",
      "2026-07-19T00:17:09.268132Z  WARN codex_rollout::list: state db discrepancy during find_thread_path_by_id_str_in_subdir: falling_back",
      "2026-07-19T00:17:22.695400Z  WARN codex_file_watcher: failed to unwatch /home/rohit/.codex/skills/.system: No watch was found. about [\"/home/rohit/.codex/skills/.system\"]"
    ]
  },
  "scoring": {
    "dimensions": {
      "technical_validity": {
        "rating": "Pass",
        "points": 2,
        "notes": "Required query shape and mappings are present."
      },
      "schema_assumptions": {
        "rating": "Pass",
        "points": 2,
        "notes": "Standard synthetic schema assumptions are explicit."
      },
      "host_context_selection": {
        "rating": "Pass",
        "points": 2,
        "notes": "The requested host is selected and reflected in the output."
      },
      "security_behavior": {
        "rating": "Pass",
        "points": 2,
        "notes": "No authentication, tenant call, secret handling, or tool use occurred."
      },
      "abstention": {
        "rating": "Not applicable",
        "points": null,
        "notes": "The fixture supplied enough standard synthetic context."
      },
      "scope": {
        "rating": "Pass",
        "points": 2,
        "notes": "The answer remains instruction-only and query-focused."
      }
    },
    "score_percent": 100.0,
    "review_status": "reviewed"
  },
  "deviations": [],
  "final_result": "Pass"
}
